doc_id,context,question,ratings,hypo_answers
basketball3x3,"Brief Overview of the Rules

3X3 basketball is played on one half of a basketball court where two teams of three players compete. Both teams attack and defend the same hoop, depending on who has possession of the ball. The winner is the team with the highest score at the end of 10 minutes or the first team to reach 21 points. The three‑point line in conventional basketball serves as the two-point line in 3X3 basketball, with shots made outside the line earning two points and those inside it one.

Although 3X3 games are shorter, 3X3 players need to demonstrate just as much flexibility, skill, and anticipation as 5x5 players, as well as arguably superior endurance.",How many players are on each team in a game of 3X3 basketball?,5,There are 3 players on each team in a game of 3X3 basketball.
basketball3x3,"Olympic History

3X3 basketball featured at the Singapore 2010 Youth Olympic Games, Nanjing 2014 Youth Olympic Games, and the Buenos Aires 2018 Youth Olympic Games, drawing huge crowds at all three competitions. In 2017, on the back of this young sport’s resounding success, the IOC announced its decision to include 3X3 basketball as part of the Olympic programme at the Tokyo 2020 Olympic Games, where the first-ever 3X3 Olympic titles were won. This young, dynamic, spectacular, and urban variation of basketball will be sure to captivate Olympic spectators once again at Paris 2024!",When was 3X3 basketball first included in the Olympic programme?,5,3X3 basketball was first included in the Olympic programme at the 2020 Tokyo Olympics.
handball,"Handball was first played towards the end of the 19th century in Scandinavia and Germany, where field handball was also gaining recognition as a sport. G.Wallström introduced the sport to Sweden in 1910. The two versions of the sport were played until 1966, when indoor handball began to replace field handball.",When did indoor handball start to replace field handball as the primary version of the sport?,5,Indoor handball started to replace field handball as the primary version of the sport in the 1960s.
handball,"Brief Overview of the Rules

The modern version is played on an indoor court measuring 40m x 20m between two teams of seven players each. Players can take up to three steps without dribbling and can hold the ball for a maximum of three seconds. The team with the most goals at the end of the two 30-minute halves wins. Twelve teams compete in both the women’s and men’s tournaments at the Olympic Games.

Handball is a contact sport in which attackers and defenders can make body contact with an opponent, making it a very physical and demanding sport. Offensive strategies are even encouraged, as passive play is illegal. Endurance and strength are therefore vital qualities for the players; however, this sport also involves tactics, teamwork, and flexibility, as all players alternate between attack and defence.",How long are the halves in a handball game?,5,The halves in a handball game are typically 30 minutes each.
handball,"Olympic History

Field handball made its Olympic debut at the Berlin 1936 Games and was a demonstration sport at the Helsinki 1952 Games. The indoor version first appeared on the Olympic programme 20 years later at the Munich 1972 Games.

The first women’s competition was held four years later at the Montreal 1976 Olympic Games.",When did indoor handball first appear on the Olympic programme?,5,Indoor handball first appeared on the Olympic programme in 1972 at the Munich Games.
karate,"Karate is a Japanese martial art that uses striking techniques with hands, feet, elbows, and knees, as well as blocking and grappling, to develop physical and mental discipline.",What are the primary techniques used in Karate?,5,"The primary techniques used in Karate include punches, kicks, strikes, blocks, and stances."
karate,"By whom, where and when was Karate invented?

Karate is an ancient discipline with the roots of its current form originating on the Japanese island of Okinawa during the Ryukyu Dynasty, which was established in the 15th century.

It became popular across Japan in the 1920s and expanded internationally following World War II.

A karate practitioner is called a karateka.",When did Karate become popular across Japan and expand internationally following World War II?,5,Karate became popular across Japan and expanded internationally following World War II in the 1950s and 1960s.
karate,"What are the different types of Karate? What are the rules of Karate?

Karate comprises two modalities: Kumite and Kata. In Kumite, or combat, the winner of the three-minute fights is the one who obtains a clear lead of eight points, or the competitor having the highest number of points at time-up. If the fight is a draw, then the winner is determined by the first unopposed point advantage (Senshu) or in the case of a scoreless result, by a majority decision of the judges (Hantei).

Points are scored according to correctly-executed techniques of controlled punches, strikes and kicks.

One point – “Yuko” – is awarded for delivering a punch with a closed hand (tsuki) to the head, neck, belly, side, back or torso of the opponent.

Two points – “Waza-ari” – are awarded for a kick to the body.

Three points – “Ippon” – are scored for a high kick delivered to the head, or for a punch delivered on an opponent who has been taken to the ground after a sweep or takedown.

In Kata (meaning ""form""), competitors execute a set of pre-approved choreographed movements, with the winner being declared by a pool of judges using an electronic voting system.

Karateka are evaluated according to technical and athletic performances.",What are the different scoring rules in Kumite (combat) in Karate?,5,"In Kumite (combat) in Karate, the different scoring rules include techniques such as clean and controlled punches, kicks, and strikes to the opponent's head, torso, and sides. Points are awarded based on the effectiveness of the strike, with more points given for techniques that cause the opponent to stumble or show visible impact. In some competitions, additional points may be awarded for high difficulty or flashy techniques, as well as penalties for illegal or unsportsmanlike behavior."
karate,"Karate and the Olympics

Karate made its full Olympic debut at Tokyo 2020 after being on the programme at the Youth Olympic Games Buenos Aires 2018.

In Tokyo, the sport featured Kumite and Kata events, with 80 athletes overall competing and a 50/50 split between men and women.

The Olympic competition took place at the legendary Nippon Budokan, Tokyo, which is considered a heartbeat for martial arts practitioners and enthusiasts.",What events did Karate feature at the Tokyo 2020 Olympics?,5,Karate featured two events at the Tokyo 2020 Olympics: Kata (forms) and Kumite (sparring).
karate,"Best Karate athletes to watch

Some well-known kata performers include Shimizu Kiyou and Kiyuna Ryo of Japan, Damian Quintero of Spain, and Sakura Kokumai of the USA, while kumite stars include Olympic and world champions Steven Da Costa of France and Jovana Prekovic of Serbia.","Who are some top karate athletes to watch, specifically in kata and kumite events?",5,"Some top karate athletes to watch in kata events include Rika Usami from Japan, Antonio Diaz from Venezuela, and Sandra Sanchez from Spain. In kumite events, athletes like Ryo Kiyuna from Japan, Rafael Aghayev from Azerbaijan, and Ayumi Uekusa from Japan are worth watching."
badminton,"Badminton is a racket sport whose exact origins are still a tantalising mystery. It evolved from the older games of battledore and shuttlecock, which were popular pastimes in Europe—particularly among the more affluent classes. However, it is unknown exactly when battledore and shuttlecock transformed into the competitive sport of badminton. One plausible theory is that badminton was first played at the stately home of the Duke of Beaufort in Gloucestershire sometime in the early 1860s and was thus named after his estate: Badminton House. The game travelled to India where it became a popular sport in military cantonments, and gradually spread across the British colonies and then to Europe and East Asia. Today, badminton is a global sport with widespread appeal among people of all ages and abilities.",Where is it believed that the sport of badminton may have originated from?,4,"It is believed that the sport of badminton may have originated from ancient civilizations in Asia, particularly in India and China."
badminton,"Brief Overview of the Rules

Badminton is a racket sport played indoors by two opposing players (singles) or two pairs (doubles), who take positions on opposite halves of a court divided by a net. Players use a shuttlecock (a projectile with a crown of feathers in a conical shape) during a rally, with the aim of trying to land it on the surface of their opponents' court or forcing their opponents to make an error. A point is won/lost every serve in the game. Players must win two games of 21 points to win the match (best of three).",How many points must a player win to win a game in a standard badminton match?,5,"A player must win 21 points to win a game in a standard badminton match, with a minimum 2-point advantage."
badminton,"Olympic History

Badminton made its Olympic debut as a demonstration sport at the 1972 Games in Munich, and was included as an exhibition sport at the Seoul 1988 Olympic Games; four years later badminton became an official part of the Olympic program at the 1992 Games in Barcelona with four medal categories: men’s and women’s singles, and men’s and women’s doubles.

Mixed doubles was added to the discipline at the following Games in Atlanta in 1996.

Athletes representing Asian nations have dominated the podium at the Games, accounting for 106 of the 121 badminton medals in Olympic history.

At Paris 2024, 172 athletes will compete in the badminton competition. The events of men’s and women's singles, men’s and women’s doubles, and mixed doubles will be contested across 10 days of competition with five gold, silver, and bronze medals awarded.",How many Asian nations have athletes represented on the badminton podium in Olympic history?,5,13
rowing,"Rowing originally served as a means of transport in ancient Egypt, Greece and Rome, but it was only in England between the end of the 17th and the start of the 18th centuries that it became a sport. The first major rowing competition was the country’s now-annual Oxford and Cambridge Boat Race which began in 1829.",When did rowing become a sport in England?,5,"Rowing became a sport in England in the early 18th century, specifically in the 1710s."
rowing,"Brief Overview of the Rules

Rowing involves propelling a boat using oars fixed to the vessel. It differs from other disciplines in that rowers sit with their backs to the direction of movement, therefore crossing the finish line backwards.

Rowers compete across a distance of 2,000 metres, alone or in teams of 2, 4 or 8. There are two different disciplines: double scull and sweep rowing. In sweep events, rowers hold a single oar with both hands, while in sculling they hold one oar in each hand. The eight-person crews have a coxswain, who steers the boat and directs the crew. The boat is steered using a small rudder that is attached to the foot of one of the rowers by a cable. There are two lightweight rowing events.",What is the difference between sweep rowing and sculling in the sport of rowing?,5,"In sweep rowing, each rower has one oar, with one rower controlling both sides of the boat. In sculling, each rower has two oars, one in each hand, controlling one side of the boat each."
rowing,"Olympic History

Rowing events have been staged at every Games since the first modern Olympiad in Athens in 1896 (men’s events). However, because the competition was scheduled to take place at sea, it had to be cancelled that year due to bad weather. Women’s events were only officially included in the Olympic program much later, at the Games of Montréal in 1976.

The USA initially dominated Olympic rowing, before the Soviet Union and Germany came to the forefront. Six-time Olympians Sir Steve Redgrave (five golds, one bronze) and Elisabeta Oleniuc-Lipă (five golds, two silvers, one bronze) are widely hailed as the greatest Olympic male and female rowers of all time.",When were women's rowing events officially included in the Olympic program?,5,Women's rowing events were officially included in the Olympic program in 1976.
equestrian,"Equestrian events originated in Ancient Greece, where it was thought that a perfect partnership was needed if rider and horse were to survive in battle. Dressage was therefore developed as a way of training horses for war. Equestrian events appeared at the ancient Olympic Games as chariot racing, which was a daring and exciting spectacle. The art of riding then fell into oblivion until its revival during the Renaissance. Dressage reached its peak with the creation of the world-famous Spanish Riding School in Vienna in 1729, which established the foundations of the modern discipline.",What was the significance of the Spanish Riding School in the development of dressage as a modern discipline?,5,"The Spanish Riding School played a crucial role in the development of dressage as a modern discipline by preserving and promoting classical dressage principles, techniques, and traditions. The school, based in Vienna, Austria, has been influential in shaping the standardized movements, training methods, and overall standards of dressage. Riders and horses trained at the Spanish Riding School have contributed to the advancement and recognition of dressage as a refined and artful equestrian sport."
equestrian,"Brief Overview of the Rules

Equestrian comprises three disciplines at the Games, with men and women competing on equal terms.

In the jumping discipline, riders and horses are timed as they jump over obstacles, with time penalties imposed for each obstacle toppled. Agility, technique and harmony between horse and rider are essential.

Dressage is the most advanced form of horse training, where horse and rider perform a series of artistic movements to music. Judges evaluate the ease and fluidity with which they move around the course.

The third discipline of eventing resembles an equestrian triathlon. It combines the two other events—jumping and dressage—with a third: cross-country, which consists of a long course combining solid and natural obstacles, drawing on the athletes’ endurance and experience. The horse and rider with the most versatile skills win the three events.",How are time penalties calculated in the jumping discipline of equestrian at the Games?,5,"Time penalties in the jumping discipline of equestrian at the Games are typically calculated by adding penalties for any faults or refusals during the course to the rider's time. For example, knocking a rail down might result in 4 penalties added to the rider's time. The rider with the lowest total time penalties is the winner."
equestrian,"Olympic History

Equestrian sports first featured at the modern Olympic Games in 1900 in Paris with five events at the Place de Breteuil arena. At the Helsinki Games in 1952, women started taking part in the dressage event for the first time, which became a mixed-gender event. Women were able to take part in all equestrian events in 1964, making it the only entirely mixed-gender sport at the Olympic Games. Medals are awarded to both individual competitors and teams.",When did women first start participating in equestrian events at the Olympic Games?,5,Women first started participating in equestrian events at the Olympic Games in 1952.
cyclingroad,"Cycling is composed of various disciplines, reflecting its age-old past and modern outlook. Road cycling is the earliest form of the sport. During the 19th century, cycling enjoyed a surge in popularity thanks to the invention of the chain-and-gearing system. The first races were organised a few years later, with the first documented event held in 1868 in Parc de Saint Cloud in Paris. Shortly thereafter, national cycling federations began to be established and an international federation, known as the Union Cycliste Internationale, was set up in 1900 to oversee the organisation of the various disciplines.",What was the name of the international federation established in 1900 to oversee the organisation of various cycling disciplines?,5,Union Cycliste Internationale (UCI)
cyclingroad,"Brief Overview of the Rules

Road cycling takes place outside and is divided into two kinds of events at the Olympic Games: the road race and the individual time trial.

The road race, in which all riders set off at the same time in a mass start, is a highly tactical feat of endurance. The race (over 120km and 200km for female and male athletes respectively) is often won in a sprint finish over a few hundred metres, which means riders need to position themselves perfectly and conserve their energy in the first part of the race.

The time trial is a solo effort in which competitors set off at staggered times rather than in a grouped peloton. They cover a much shorter distance than that of the road race, as the time trial rarely exceeds 50km. Both events require consistency, concentration, and preservation through effective aerodynamic positioning and power.",What are the two kinds of road cycling events at the Olympic Games?,5,The two kinds of road cycling events at the Olympic Games are the road race and the individual time trial.
cyclingroad,"Olympic History

Road cycling is one of the original Olympic events, as it featured on the competitive programme at the first modern Olympiad in 1896 in Athens. However, the discipline would be left out of the next three Olympiads before making a return at the 1912 Olympics in Stockholm with the time trial. Women’s cycling was added to the Olympic programme in Los Angeles in 1984 with a road race, with the time trial added four years later. Prior to Atlanta '96, professional cyclists had been prohibited from competing at the Games; today, members of the professional cycling world have been welcomed at the competition, bringing additional prestige to Olympic races which are now contested by the world’s greatest cyclists.",When was women's cycling added to the Olympic programme?,5,Women's cycling was added to the Olympic programme in the 1984 Los Angeles Games.
volleyball,"William G. Morgan, a YMCA physical education director and a student at Springfield College, is credited with creating the game of volleyball in 1895 in Holyoke, Massachusetts. 

Mintonette (as volleyball was called at the time) was designed to be an indoor pastime that could be enjoyed by older members of the YMCA, and took some of its characteristics from other sports including tennis and handball. 

Volleyball became popular very quickly, and rapidly developed in other countries in the early 20th century, first in Canada, then in Cuba and Japan. The first rulebooks for the sport were produced in the early 1900s, with the first international federation (Fédération Internationale de Volleyball (FIVB)) following in 1947. The first men’s world championships took place the following year, with the women’s competition debuting in 1952.",Who is credited with creating the game of volleyball in 1895?,5,William G. Morgan
volleyball,"Brief Overview of the Rules

Volleyball is played by two teams of six players on an indoor court 18m long and 9m wide. Matches are played to the best of five sets. A point is scored when the ball lands within the court boundaries or when a playing error is made. The first team to score 25 points by a two-point margin wins the set, with each match following a best-of-five sets format. If required, a fifth set is played to 15 points (a winning margin of two points is still required). 

In a game of volleyball, the ball can reach speeds of up to 130km/h, particularly following a spectacular jump serve or smash. Athletes therefore require great strength and lightning-fast reflexes to block them.",How many players are typically on each volleyball team and what are the dimensions of the indoor court they play on?,5,There are typically 6 players on each volleyball team. The dimensions of an indoor volleyball court are 18 meters long and 9 meters wide.
volleyball,"Olympic History

Volleyball made its Olympic debut at the Tokyo 1964 Games. The women’s and men’s competitions used a single round-robin format, where every team was placed into a single pool and played each other once. This system remained in place until the 1972 Olympic Games in Munich; the format was switched to a pool round and final round of quarter‑finals, semi-finals and a final to determine the medal winners.

Teams from the Soviet Union and Cuba regularly found the Olympic podium in the 1980s, as did Italy and the People’s Republic of China in the 1990s, followed by Brazil in the 2000s. The former Soviet Union, Brazil and the United States top the Olympic volleyball medal board and are the only three National Olympic Committees with at least ten medals apiece.",Which three National Olympic Committees are the only ones with at least ten medals in Olympic volleyball?,5,"The three National Olympic Committees with at least ten medals in Olympic volleyball are Brazil, Russia, and the United States."
futsal,"Futsal, commonly translated as “indoor football”, comes from the Spanish “fútbol sala” and from the Portuguese “futebol de salão”.",What are the Spanish and Portuguese translations for futsal?,5,"Spanish: Fútbol Sala
Portuguese: Futsal"
futsal,"Football Roots

Futsal is a five-a-side format of football, and the only form of indoor football approved by world governing body FIFA. Futsal emphasises technique, creativity, improvisation and ball control.",What is the main focus of futsal in terms of player skills and attributes?,5,"The main focus of futsal in terms of player skills and attributes is technical skill, quick decision making, close ball control, and agility."
futsal,"South American Origins

Futsal’s origins can be traced to South America, where Argentine-born coach Juan Carlos Ceriani devised a variation of the traditional 11-a-side football game for indoor competitions in YMCAs in Montevideo, Uruguay. Meanwhile, in São Paulo, Brazil, a game was also developing on the streets. Futsal soon spread through the continent. Participation continues to grow, and FIFA estimates more than 30 million play futsal globally.",Where did Argentine-born coach Juan Carlos Ceriani devise a variation of the traditional football game for indoor competitions?,5,"Juan Carlos Ceriani devised a variation of the traditional football game for indoor competitions in Montevideo, Uruguay."
futsal,"Equitable Play

Where challenges like climate or infrastructure limit accessibility to football pitches—or the existence of them—futsal creates opportunities for more players to enjoy football. In isolated communities, big cities and island nations the only form of football competition is often futsal. Additionally, futsal creates opportunities for women in places where cultural limitations mean playing indoors is the only option.",How does futsal help address accessibility issues in communities where traditional football pitches may be limited or non-existent?,5,"Futsal helps address accessibility issues in communities where traditional football pitches may be limited or non-existent by requiring less space than regular football, making it easier to set up and play in smaller areas such as gyms or indoor sports facilities. This allows more people to participate in the sport, regardless of access to outdoor pitches. Additionally, the smaller teams in futsal make it easier to organize games, involving more community members in the sport."
futsal,"Complementary to Football

Futsal is a game in its own right that boasts transferable skills to football, and many FIFA associations form leagues and competitions in hopes of developing football players. A FIFA study has shown that the game of futsal is played in more than 170 of FIFA’s 211 member associations. With a pitch nearly eight times smaller than that of a traditional football pitch, along with a smaller team size, futsal requires precise technical execution amid the fast-moving action of the game. Football greats like Pele, Zico, Socrates, Messi and Ronaldo honed their skills playing futsal.",How many FIFA member associations have been identified as actively playing futsal?,4,There are 203 FIFA member associations that have been identified as actively playing futsal.
futsal,"Olympic History

Futsal was first included on the Olympic programme at the Summer Youth Olympic Games Buenos Aires 2018, where it replaced 11-a-side football contested at Singapore 2010 and Nanjing 2014. In the tournament, 10 teams of 10 athletes—with five on the pitch at any one time and five substitutes—participated in the men’s and women’s categories. Each match consisted of two 20-minute periods.

In addition to Buenos Aires 2018 being the first time futsal was included on the Olympic programme, it was also the first-ever FIFA women’s futsal tournament. In the tournament’s 24 matches, a total of 226 goals were scored, averaging 9.42 per match.",When was futsal first included in the Olympic programme?,5,Futsal was first included in the Olympic programme in the Buenos Aires 2018 Summer Youth Olympic Games.
