doc_id,context,question,ratings,hypo_answers
weightlifting,"Weightlifting—often known as Olympic weightlifting—has been around for thousands of years, yet the objective remains the same: the athlete who lifts the most weight wins. Evidence of the sport dates to ancient Egypt and Greece, where people lifted heavy stones in contests of strength. Weightlifting re-emerged in the 19th century, when the first World Weightlifting Championships were held in 1891.",When were the first World Weightlifting Championships held?,5,The first World Weightlifting Championships were held in 1891.
weightlifting,"Brief Overview of the Rules

The Olympic weightlifting programme has greatly evolved over time. Since the Montreal 1976 Games, there have been two lifts used in competition: the snatch and the clean and jerk. In the snatch, the bar is lifted from the floor to above the head in one movement. By contrast, the clean and jerk is a two-stage action: the bar is first brought up to the shoulders before being jerked over the head. These extremely demanding exercises require exceptional physical strength and ironclad mental resolve.

Today, competitors perform both lifts three times, and their best result in each lift are combined to determine their overall score. The competitor with the highest total score is declared the winner. Men and women will each compete across five weight classes for the Paris 2024 Olympic Games.",How are the winners determined in Olympic weightlifting competitions?,5,The winners in Olympic weightlifting competitions are determined based on the total weight lifted by the athletes in two main lifts: the snatch and the clean and jerk. The athlete with the highest total weight lifted in both lifts combined is declared the winner in their respective weight class.
weightlifting,"Olympic History

Weightlifting featured at the first modern Olympic Games held in Athens in 1896. Excluded from the Olympic programme for a few editions of the Games (1900, 1908 and 1912), weightlifting was reintroduced in 1920 at the Antwerp Games and has been included ever since. A women’s competition was first held at the Sydney 2000 Games.

At the beginning of the 20th century, European National Olympic Committees (NOCs) – particularly Germany, Austria and France – dominated weightlifting. From the 1950s onwards, Soviet athletes topped the podium until the 1990s, when athletes representing the People’s Republic of China, Türkiye, Greece and the Islamic Republic of Iran began to claim the majority of medals on offer. China has been dominating women’s weightlifting since it was introduced as an official Olympic sport in 2000.",When was the first women's weightlifting competition held at the Olympic Games?,4,"The first women's weightlifting competition was held at the Olympic Games in 2000 in Sydney, Australia."
sailing,"International sailing races began in 1851 when members of the New York Yacht Club decided to take part in a competition in England. To compete, they built a 101‑foot schooner named America, sailed to England and won a trophy called the Hundred Guineas Cup. The trophy was then renamed The America’s Cup in memory of this first international sailing competition.",What was the name of the first international sailing competition that took place in 1851 where the 101-foot schooner America won the Hundred Guineas Cup?,5,The America's Cup
sailing,"Brief Overview of the Rules

Sailing involves moving a boat solely by harnessing the power of the wind. Mastery over ever‑changing conditions requires both great skill and experience on the part of the athletes. In Olympic events, the rules of the international sailing federation, World Sailing, apply. Competitions are made up of fleet racing, where two equally-matched boats race around the same varied course.

There were ten events at the Tokyo Games, including windsurfing, mixed Nacra 17 Foiling, 49ers and the 470. The various sailing disciplines are constantly changing, and boats are designed to be increasingly small and lightweight, placing ever greater demands on both the athletic and technical capacities of the sailors. Two new events will take place for the first time at the Olympic Games in 2024: windsurfer – iQFoil and kiteboarding.",What are the two new events that will be introduced at the Olympic Games in 2024?,5,Surfing and skateboarding
sailing,"Olympic History

Sailing has featured on the programme at every edition of the Olympic Games of the modern era. They could not take place on 1st April 1896 in Athens, however, as bad weather conditions forced the organisers to cancel the events. The first competitions therefore took place at the Olympic Games in Paris in 1900. Since then, the categories included in the competition have constantly evolved. The different events are organised by monotype classes—i.e. their size and weight.",When did sailing first feature on the programme at the Olympic Games of the modern era?,5,Sailing first featured on the programme at the Olympic Games of the modern era in 1900.
trampolinegymnastics,"Trampolining was invented in 1934 by American gymnast George Nissen who, after watching trapeze acrobats perform tricks while bouncing off safety nets, built the first prototype trampoline to recreate their acrobatics. Initially used as a piece of equipment to train astronauts and athletes training for other acrobatic sports, the trampoline quickly became immensely popular as a sport in its own right. The first trampoline world championships were organised in London in 1964, and the sport joined the International Gymnastics Federation 34 years later in 1998.",Who invented trampolining and when?,5,The modern trampoline was invented by George Nissen and Larry Griswold in 1936.
trampolinegymnastics,"Brief Overview of the Rules

The two individual trampoline events (men’s and women’s) involve athletes bouncing over 8 metres high in the air on a trampoline, which is a rectangular canvas made of synthetic fabric, to perform a series of twists, bounces and somersaults.

The trampoline bed is attached to a frame with steel springs so that its recoil action propels athletes high into the air. During competition, athletes perform routines composed of ten elements, scored according to their difficulty, execution and time spent in the air. The sport is highly technical and requires absolute precision.",How is scoring determined in individual trampoline events based on the provided context?,5,"Scoring in individual trampoline events is determined based on the difficulty and execution of the routine performed by the gymnast. Judges assign points for each element of the routine, including jumps, twists, and flips, as well as deductions for any mistakes or technical errors. The total score is calculated by adding up the points earned for each element and deducting any penalties, resulting in a final score for the performance."
trampolinegymnastics,"Olympic History

Trampolining made its first appearance at the 2000 Games in Sydney, with men’s and women’s competitions. The number of events (two) has remained unchanged since then. Since its inclusion at the Olympic Games, athletes from the People’s Republic of China have won 14 of the 36 medals awarded, including four gold medals However, Canadian Rosie MacLennan is the only athlete to successfully defend an Olympic trampoline title—a feat she accomplished at Rio 2016 after first winning gold at London 2012.",Who is the only athlete to successfully defend an Olympic trampoline title?,5,Rosie MacLennan
waterpolo,"Water polo was initially a dangerous sport that first developed in the rivers and lakes of mid-19th century England as an aquatic version of rugby. In 1870, the London Swimming Association developed rules for the sport to be used in indoor swimming pools. Later rules that developed in Scotland emphasized a football style of play as opposed to the “rugby variant.” Water polo was introduced to the USA in 1888, where the rugby style of play—similar to the sport of American football—was used in the water. However, the rest of the world adopted the Scottish rules of the sport, which formed the basis for the sport of water polo as we know it today. The first international match took place in 1890 between England and Scotland (Scotland won 4-0).","What were the two main styles of play that developed in the early history of water polo, and which one ultimately became the basis for the modern sport?",5,"The two main styles of play that developed in the early history of water polo were the Scottish ""football in the water"" style and the English ""swimming in the water"" style. It was the Scottish style, with its rough and physical play, that ultimately became the basis for the modern sport of water polo."
waterpolo,"Brief Overview of the Rules

Two teams of seven players face off in a 3m deep pool, the dimensions of which are not fixed and can vary between 20×10 and 30×20 meters. World Aquatics-approved matches require a 30x20 meter pool for men and a 25x20 meter pool for women. Matches consist of four eight-minute quarters. Other than the goalkeeper, players may only hold the ball with one hand. Possession lasts 30 seconds; if the team does not attempt a shot within that time, possession passes to the opposition and the shot clock is reset.

Water polo is an intensely physical sport; contact is permitted with players possessing the ball. Strength, endurance, power and strategy are therefore essential.",What are the dimensions of the pool required for World Aquatics-approved water polo matches for men and women?,5,"The dimensions for a World Aquatics-approved water polo pool for men are 30 meters x 20 meters, with a minimum depth of 2 meters. For women, the dimensions are slightly smaller at 25 meters x 17 meters, with the same minimum depth of 2 meters."
waterpolo,"Olympic History

Water polo is one of the oldest team sports at the modern Olympic Games, as it was added to the programme at the same time as rugby in 1900 – first in the form of competitions between clubs, then tournaments between countries from 1908. However, it wasn’t until Sydney 2000, a century later, that the women’s competition was introduced at the Olympic Games.

European National Olympic Committees have been the dominant force in men’s water polo for years, with an NOC from the continent winning gold at every edition of the Games since 1908. Hungary tops the men’s medal table with 16 medals (including nine golds). Women’s water polo at the Olympics is still in its infancy, but the USA are the reigning three-time champions after winning gold at London 2012, Rio 2016 and Tokyo 2020.",When was women's water polo introduced to the Olympic Games?,5,Women's water polo was introduced to the Olympic Games in the year 2000 during the Sydney Olympics.
biathlon,Biathlon combines the power and aggression of cross-country skiing with the precision and calm of marksmanship.,What two elements does biathlon combine?,5,Biathlon combines the elements of cross-country skiing and rifle shooting.
biathlon,"Roots in Survival

The word ""biathlon"" stems from the Greek word for two contests, and is today seen as the joining of two sports: skiing and shooting. Biathlon has its roots in survival skills practised in the snow-covered forests of Scandinavia, where people hunted on skis with rifles slung over their shoulders.",What two sports are combined to create the biathlon?,5,Cross-country skiing and rifle shooting.
biathlon,"Standardising the Rules

In 1948, the Union Internationale de Pentathlon Moderne et Biathlon (UIPMB) was founded to standardise the rules for biathlon and pentathlon. In 1993, the biathlon branch of the UIPMB created the International Biathlon Union (IBU), which officially separated from the UIPMB in 1998.",When was the International Biathlon Union officially created?,5,"The International Biathlon Union was officially created on November 2, 1993."
biathlon,"First Competition

Biathlon-type events in Scandinavia are known to have been held as early as the 18th century. The first modern biathlon probably occurred in 1912, when the Norwegian military organised the Forvarsrennet in Oslo. An annual event, it consisted initially of a 17km cross-country ski race with two-minute penalties incurred by misses in the shooting part of the competition.",When and where did the first modern biathlon take place?,5,The first modern biathlon took place in Norway in 1912.
biathlon,"Olympic History

In 1924 in Chamonix, an ancient form of biathlon made its Olympic debut: the military patrol. This event was then in demonstration in 1928, 1936 and 1948. After some attempts to incorporate it into a winter pentathlon, biathlon appeared at the Games in its current form in 1960 in Squaw Valley. Women’s biathlon made its first appearance on the Olympic programme in Albertville in 1992.

Until the 1976 Games in Innsbruck, the events comprised an individual race and a relay. In Lake Placid in 1980, a second individual event was introduced.

In Salt Lake City in 2002, a 12.5km pursuit event was added for men and 10km for women. From Turin in 2006, a new mass-start event was introduced for both men and women. This brings together the 30 best athletes from the World Cup.",When did women's biathlon first appear on the Olympic programme?,5,Women's biathlon first appeared on the Olympic programme in 1992 at the Albertville Winter Olympics.
tennis,"The precursor to tennis was the “jeu de paume,” or “game of the hand,” which originated in France in the 11th century. It was played in a monastery courtyard and involved using one's palm to hit a ball against walls and sloping roofs. Tennis, as we know it today, was developed in 19th-century England. As the sport’s soaring popularity overtook that of croquet, the All England Croquet Club decided to allow its lawns to be used for tennis. Several national federations were set up throughout the world during the 19th century, culminating in the birth of the International Lawn Tennis Federation—now known as the International Tennis Federation—in 1913.",What was the precursor to tennis and where did it originate?,5,"The precursor to tennis was most likely real tennis, also known as court tennis, and it originated in France."
tennis,"Brief Overview of the Rules

Olympic tennis consists of events in men’s and women’s singles, and men’s, women’s and mixed doubles. Singles matches are played to the best of three sets with a standard tie-break in every set, including the final set.",What events are included in Olympic tennis?,5,Singles and doubles events for both men and women are included in Olympic tennis.
tennis,"Olympic History

Tennis has been contested in sporadic fashion throughout Olympic Games history. It first featured at the first modern Olympiad in Athens in 1896, but was withdrawn from the programme after the 1924 Olympic Games due to disputes between the International Lawn Tennis Federation and the International Olympic Committee over how to define amateur players. Despite a return as a demonstration event at Mexico 1968 and Los Angeles 1984, tennis did not make a definitive comeback as a full medal sport at the Olympic Games before Seoul 1988. Since then, some of the world’s greatest tennis players have competed at each edition of the Games. In recent years, the gold medal has been taken home by several superstars, including Rafael Nadal, Olympic champion in the singles event in 2008 and doubles in 2016; Stan Wawrinka and Roger Federer, Olympic doubles champions in 2008; and Serena and Venus Williams, who have won eight Olympic titles between them.",When did tennis return as a full medal sport at the Olympic Games after being withdrawn in 1924?,5,Tennis returned as a full medal sport at the Olympic Games in 1988.
marathonswimming,"At the first three editions of the modern Olympic Games, all swimming events took place in a natural body of water prior to the inclusion of pools at the Games in 1908. Marathon swimming reappeared in 1991 when the discipline was officially introduced at the FINA World Swimming Championships (now known as the World Aquatics Championships); at the time, events were held over 25km and took over five hours to complete. The first time the 10km race was contested was at the World Swimming Championships in Fukuoka, Japan in 2001.",When was the first time the 10km marathon swimming race was contested at the World Swimming Championships?,5,The first time the 10km marathon swimming race was contested at the World Swimming Championships was in 1991.
marathonswimming,"Brief Overview of the Rules

Marathon swimming takes places in open water environments such as the sea, rivers and lakes. Athletes must complete a 10km course, which takes nearly two hours to complete; their endurance, physical strength and brain power are all put to the test.

An ability to adapt is also crucial; tides and currents change quickly at sea, and the athletes must consider this in their strategy. Using the right tactics for the course and conditions is therefore key. In the last 3km, swimmers begin to make their move for the finish line—how they manage their efforts becomes essential and is what ultimately influences the end result.","What distance must athletes complete in a marathon swimming event, and what factors must they consider in order to be successful in this challenging sport?",5,"Athletes must complete a distance of 10 kilometers in a marathon swimming event. In order to be successful in this challenging sport, athletes must consider factors such as proper pacing, nutrition and hydration throughout the race, weather conditions, currents, navigation, and mental toughness. They also need to train extensively to build endurance and strength, as well as practice open water swimming techniques."
marathonswimming,"Olympic History

Marathon swimming became the latest swimming discipline to be added to the Olympic programme when the 10km race was introduced at the Beijing Games in 2008. The short history of this discipline means that few National Olympic Committees and athletes have had a chance to stand out in marathon swimming.

Although certain athletes focus solely on marathon swimming, others were previously specialists in other freestyle pool events, making these swimmers highly competitive. A prime example is Tunisian swimmer Oussama Mellouli, who won the gold medal in the men’s 1,500m freestyle event in Beijing in 2008 and then won the men’s marathon swimming event in London four years later.",When was marathon swimming first added to the Olympic programme?,4,Marathon swimming was first added to the Olympic programme in 2008 at the Beijing Olympics.
football,"Although football can trace its roots back to Ancient China, the modern version of the game was born on the streets of medieval England, before going on to become the most popular sport in the world.

The (very) early games of football in medieval England involved a large mass of people who would attempt to drag a pig’s bladder—by any means possible—to markers at opposing ends of a town. Such events were well known for being as violent as they were popular. In the 16th century, English schools established the modern football codes, thereby transforming what were mob riots into a proper sport.",What is the origin of the modern version of football?,5,The modern version of football originated in England in the 19th century.
football,"Brief Overview of the Rules

The women’s competition at the Olympic Games is organised in exactly the same way as FIFA tournaments: two teams of 11 players contest a 90-minute match (plus stoppage time) split into two 45-minute halves on a grass pitch. The same rules apply to the men’s game, but with a slight difference in the composition of the teams: each team must be made up entirely of players born on or after 1 January 2001 (aged 23 at the time of Paris 2024) However, three (3) footballers born before the mentioned date, above the age limit, can be included in the squad list (18 players per team).

Football is also one of the few sports at the Games where the tournament starts before the opening ceremony due to the number of matches; since the Sydney 2000 Olympic Games, the football tournament has started two days before the Games are officially opened.",What is the maximum age limit for players competing in the women's football tournament at the Olympic Games?,5,"The maximum age limit for players competing in the women's football tournament at the Olympic Games is 23 years old, with the exception of three overage players allowed per team."
football,"Olympic History

Football was first included on the Olympic programme at the Games of the II Olympiad (Paris 1900) and has been contested at every edition since, save for the Los Angeles 1932 Games (in an attempt to promote the new men’s FIFA World Cup tournament). 

Women’s football made its Olympic debut at the Atlanta Games in 1996. The USA has finished on top of the podium multiple times, including at Atlanta 1996, Athens 2004, Beijing 2008 and London 2012. Germany won gold at Rio 2016, while Canada are the defending Olympic champions after triumphing at Tokyo 2020.

Europe dominated the men’s competition until the 1992 Games in Barcelona, where Spain became the last European team to win a gold medal. Since the 1996 Olympic Games in Atlanta, African and Latin American teams have won every gold medal, with Brazil repeating as Olympic champions at Tokyo 2020.

Many footballing greats have taken part in the Olympic Games, including Ferenc Puskás in 1952, Lev Yashin in 1956, Samuel Eto’o in 2000, Lionel Messi in 2008, Neymar in 2012 and 2016, Marta in 2004, 2008, 2012, 2016 and 2020, and Alex Morgan in 2012, 2016 and 2020.",When did women's football first make its Olympic debut?,5,Women's football first made its Olympic debut at the Atlanta 1996 Summer Olympics.
diving,"In the early 19th century, gymnasts in Germany and Sweden popularised ‘fancy’ diving by performing elaborate acrobatics while jumping into the water.

Towards the end of the 19th century, Swedish divers travelled to Great Britain to perform diving demonstrations at the National Graceful Diving Competition (the first world championship event in high diving), which led to the establishment of the Amateur Diving Association in 1901.",What countries played a key role in the popularization of 'fancy' diving in the early 19th century?,2,England and Sweden played a key role in the popularization of 'fancy' diving in the early 19th century.
diving,"Brief Overview of the Rules

At the Olympic Games, the sport is contested in eight events: the 3-metre springboard (individual and synchronised, men and women) and the 10-metre platform (individual and synchronised, men and women). The 3-metre springboard enables divers to leap high into the air, while the high dive is performed from a fixed platform position 10 metres above the water. The individual and synchronised competitions take place at both heights.

A panel of judges score each dive based on various criteria, including how aesthetically pleasing a diver’s movements are, the complexity of the dive and how well the diver enters the water. Synchronised diving is also scored on how well the two divers match each other’s movements.",How many events are contested in diving at the Olympic Games?,5,There are currently 8 events contested in diving at the Olympic Games.
diving,"Olympic History

Diving made its Olympic debut at the 1904 Games in St. Louis and has been included at every Games since. The first women’s events were contested at the 1912 Games in Stockholm, while the synchronised competition was added to the programme at the Sydney 2000 Olympic Games.

Diving events at the Games were initially dominated by Team USA athletes, though in recent Olympiads competitors from the People’s Republic of China have been formidable (Chinese athletes won 12 of the 24 available diving medals, including seven golds, at the Tokyo 2020 Olympic Games).",When did diving first make its Olympic debut?,5,Diving first made its Olympic debut in 1904 at the St. Louis Olympics.
wrestling,"Wrestling is one of the oldest sports in human history—if not the oldest. Multiple sculptures, reliefs and cave drawings—some of which date to around 15,000 years ago—show wrestlers using various holds that are still used in the present-day sport. Wrestling was a key part of the ancient Olympic Games, where it was first contested in 708 BCE. Wrestling matches were organised as its own event in two disciplines (‘upright’ and ‘ground’ wrestling) and as part of the pentathlon.

Modern wrestling consists of two separate disciplines: Greco-Roman wrestling, a wrestling style based on the ancient sport, and freestyle wrestling, a more modern format.",What are the two main disciplines of modern wrestling?,5,The two main disciplines of modern wrestling are freestyle wrestling and Greco-Roman wrestling.
